{
  "$schema": "https://json-schema.org/draft/2020-12/schema",
  "$id": "https://github.com/marcmalerei/gluon/blob/main/release/release-cut-evidence.schema.json",
  "title": "Gluon release-cut evidence",
  "type": "object",
  "additionalProperties": false,
  "required": [
    "schemaVersion",
    "releaseVersion",
    "testedCommit",
    "cutAt",
    "automatedQualityRun",
    "hostingPreflight",
    "supportBoundary",
    "acceptedBy",
    "acceptedAt"
  ],
  "properties": {
    "$schema": { "type": "string" },
    "schemaVersion": { "const": 1 },
    "releaseVersion": { "type": "string", "pattern": "^[1-9][0-9]*\\.[0-9]+\\.[0-9]+$" },
    "testedCommit": { "type": "string", "pattern": "^[a-f0-9]{40}$" },
    "cutAt": { "type": "string", "format": "date-time" },
    "automatedQualityRun": {
      "type": "object",
      "additionalProperties": false,
      "required": ["url", "conclusion"],
      "properties": {
        "url": { "type": "string", "format": "uri", "pattern": "^https://github.com/marcmalerei/gluon/actions/runs/[0-9]+$" },
        "conclusion": { "const": "success" }
      }
    },
    "hostingPreflight": {
      "type": "object",
      "additionalProperties": false,
      "required": ["immutableReleases", "releaseTagRulesets"],
      "properties": {
        "immutableReleases": {
          "type": "object",
          "additionalProperties": false,
          "required": ["enabled", "enforcedByOwner", "checkedBy", "checkedAt"],
          "properties": {
            "enabled": { "const": true },
            "enforcedByOwner": { "type": "boolean" },
            "checkedBy": { "const": "marcmalerei" },
            "checkedAt": { "type": "string", "format": "date-time" }
          }
        },
        "releaseTagRulesets": {
          "type": "object",
          "additionalProperties": false,
          "required": [
            "creationRulesetId",
            "immutabilityRulesetId",
            "creationBypass",
            "immutabilityBypassActorCount",
            "checkedBy",
            "checkedAt"
          ],
          "properties": {
            "creationRulesetId": { "type": "integer", "minimum": 1 },
            "immutabilityRulesetId": { "type": "integer", "minimum": 1 },
            "creationBypass": {
              "type": "object",
              "additionalProperties": false,
              "required": ["actorId", "actorType", "bypassMode"],
              "properties": {
                "actorId": { "type": "integer", "minimum": 1 },
                "actorType": { "const": "User" },
                "bypassMode": { "const": "always" }
              }
            },
            "immutabilityBypassActorCount": { "const": 0 },
            "checkedBy": { "const": "marcmalerei" },
            "checkedAt": { "type": "string", "format": "date-time" }
          }
        }
      }
    },
    "supportBoundary": {
      "type": "object",
      "additionalProperties": false,
      "required": [
        "model",
        "brandedBrowserSupportClaimed",
        "operatingSystemSupportClaimed",
        "deviceSupportClaimed",
        "assistiveTechnologySupportClaimed",
        "manualBrowserDeviceEvidenceRequired",
        "manualAssistiveTechnologyEvidenceRequired",
        "singleOperatorRiskAccepted"
      ],
      "properties": {
        "model": { "const": "automated-engine-evidence-only" },
        "brandedBrowserSupportClaimed": { "const": false },
        "operatingSystemSupportClaimed": { "const": false },
        "deviceSupportClaimed": { "const": false },
        "assistiveTechnologySupportClaimed": { "const": false },
        "manualBrowserDeviceEvidenceRequired": { "const": false },
        "manualAssistiveTechnologyEvidenceRequired": { "const": false },
        "singleOperatorRiskAccepted": { "const": true }
      }
    },
    "acceptedBy": { "const": "marcmalerei" },
    "acceptedAt": { "type": "string", "format": "date-time" }
  }
}
