{
  "$schema": "../release-cut-evidence.schema.json",
  "schemaVersion": 1,
  "releaseVersion": "1.3.0",
  "testedCommit": "a2328d2f10b3281daf3aea709f8fbb6268741750",
  "cutAt": "2026-07-23T18:33:03Z",
  "automatedQualityRun": {
    "url": "https://github.com/marcmalerei/gluon/actions/runs/30032812449",
    "conclusion": "success"
  },
  "hostingPreflight": {
    "immutableReleases": {
      "enabled": true,
      "enforcedByOwner": false,
      "checkedBy": "marcmalerei",
      "checkedAt": "2026-07-23T18:33:03Z"
    },
    "releaseTagRulesets": {
      "creationRulesetId": 18869893,
      "immutabilityRulesetId": 18869897,
      "creationBypass": {
        "actorId": 25964605,
        "actorType": "User",
        "bypassMode": "always"
      },
      "immutabilityBypassActorCount": 0,
      "checkedBy": "marcmalerei",
      "checkedAt": "2026-07-23T18:33:03Z"
    }
  },
  "supportBoundary": {
    "model": "automated-engine-evidence-only",
    "brandedBrowserSupportClaimed": false,
    "operatingSystemSupportClaimed": false,
    "deviceSupportClaimed": false,
    "assistiveTechnologySupportClaimed": false,
    "manualBrowserDeviceEvidenceRequired": false,
    "manualAssistiveTechnologyEvidenceRequired": false,
    "singleOperatorRiskAccepted": true
  },
  "acceptedBy": "marcmalerei",
  "acceptedAt": "2026-07-23T18:33:03Z"
}
